{
  "schemaVersion": 1,
  "simulationOnly": true,
  "id": "WPHX-UNSAFE-9998",
  "boundaryId": "UB-SYNTHETIC-COMPILER-PRIVATE-ADAPTER",
  "category": "php-raw-segment",
  "reason": "Synthetic ancestor fixture proving that renewal requires a fully authenticated prior waiver and lifecycle.",
  "owner": "Marcelo Serpa",
  "review": {
    "receiptId": "WPHX-UNSAFE-REVIEW-9998-01",
    "path": "fixtures/unsafe-boundary/reviews/WPHX-UNSAFE-REVIEW-9998-01.json",
    "sha256": "a6caec1639afdb064c2692724c3355d62d3fab6851a507403c07e71c899b8642"
  },
  "lifecycle": {
    "ledgerId": "WPHX-UNSAFE-LIFECYCLE-9998",
    "path": "fixtures/unsafe-boundary/lifecycle/WPHX-UNSAFE-LIFECYCLE-9998.json",
    "sha256": "2c16dbcf0092bc04e2e65acba4549332d719ad7cd7d413ebd0ca3506168d17ea",
    "currentRecordId": "WPHX-UNSAFE-LIFECYCLE-9998-02"
  },
  "createdAt": "2026-07-19T20:00:00Z",
  "expiresAt": "2026-09-01T00:00:00Z",
  "risk": {
    "severity": "medium",
    "threat": "A raw compiler-private segment could bypass typed emission if this were a production boundary.",
    "mitigation": "The fixture is non-executable and the production API remains withheld."
  },
  "source": {
    "path": "fixtures/unsafe-boundary/evidence/compiler-private-adapter.txt",
    "sha256": "94d447a48c98cf2ffcb56fc713fa17eaedc9799381b28f01b82b0e0013e2e11c",
    "startLine": 1,
    "endLine": 3
  },
  "scope": {
    "package": "compiler/reflaxe.php",
    "layer": "compiler-private-adapter",
    "profiles": [
      "generic-php"
    ],
    "targets": [
      "php"
    ]
  },
  "evidence": [
    {
      "path": "fixtures/unsafe-boundary/scenarios.json",
      "sha256": "9d81dbe4451c865abfdb1ec03d392e931b6457f25b0c026f786e058e7a86be2e"
    }
  ],
  "removal": {
    "bead": "wordpresshx-sdk-052",
    "deadline": "2026-09-01T00:00:00Z",
    "successCondition": "Supersede this synthetic ancestor with a new independently reviewed waiver or remove it before SDK-052 closure."
  }
}
